{
  "schema_version": 1,
  "generator": "plaudon-speaker-embed 0.1.0",
  "measured_on": "2026-10-13T01:58:47Z",
  "commit": "0a6b775a03514c08cf9da1a66ac9faf623f2994b",
  "provider": {
    "provider_id": "onnx-pyannote-wespeaker",
    "provider_version": "3.0+voxceleb-2022-10",
    "validated": false,
    "models": [
      {
        "model_id": "wespeaker-resnet34-lm",
        "version": "voxceleb-2022-10",
        "sha256": "e9848563da86f263117134dfd7ad63c92355b37de492b55e325400c9d9c39012",
        "licence_spdx": "CC-BY-4.0",
        "role": "256-dimensional speaker embedding over a window of single-speaker speech"
      },
      {
        "model_id": "pyannote-segmentation",
        "version": "3.0",
        "sha256": "220ad67ca923bef2fa91f2390c786097bf305bceb5e261d4af67b38e938e1079",
        "licence_spdx": "MIT",
        "role": "frame-level speaker-activity segmentation, including overlap"
      }
    ],
    "parameters": [
      {
        "name": "window_step_frames",
        "value": "59",
        "provenance": "a tenth of the ten-second window, the step pyannote's own pipeline uses"
      },
      {
        "name": "min_track_ms",
        "value": "1000",
        "provenance": "declared floor: a shorter track is not embedded at all"
      },
      {
        "name": "cluster.threshold",
        "value": "0.7045",
        "provenance": "sherpa-onnx's documented default for this checkpoint pair; not tuned on these sessions"
      },
      {
        "name": "assemble.activity_threshold",
        "value": "0.50",
        "provenance": "majority of the windows covering a frame"
      },
      {
        "name": "speaker_count_hint",
        "value": "none",
        "provenance": "the speaker count is inferred, never supplied: a hinted run would measure an easier problem than the product's"
      }
    ]
  },
  "runtime": {
    "platform": "macos-arm64",
    "host_cpu": "Apple M5",
    "os_build": "macos 27.0.1 (26A434)",
    "intra_op_threads": 1,
    "peak_rss_bytes": 318439424,
    "startup_ms": 75,
    "real_time_factor": 0.14212133569304156
  },
  "corpus": {
    "library_id": "librispeech-session-v1",
    "corpus": "libri_speech_test_clean_derived",
    "licence": "CC-BY-4.0",
    "attribution": "LibriSpeech (Panayotov et al., openslr.org/12), CC-BY-4.0, derived from public-domain LibriVox recordings; used as test material only",
    "audio_committed": false,
    "recipe": "each speaker's utterances are cut from their LibriSpeech reader in corpus order, scaled to 0.08 RMS, faded in and out over 160 samples and summed into the session timeline at the plan's offsets; the finished mix is scaled down if its peak exceeds 0.99. Between turns the mix is digital silence."
  },
  "sessions": [
    {
      "session_id": "librispeech-session-01",
      "condition": "clean",
      "media_sha256": "ad3db3c1f7e6543f739d17e6d3048fced79c5e9ead1c81f7727df067e71dcc20",
      "duration_ms": 102000,
      "reference_speakers": 4,
      "reference_speech_ms": 96000,
      "overlapping_reference_ms": 3000,
      "hypothesis_clusters": 4,
      "hypothesis_turns": 30,
      "elapsed_ms": 14240,
      "der": {
        "overall": {
          "der": 0.11760416666666666,
          "missed_ms": 1320,
          "false_alarm_ms": 2730,
          "confusion_ms": 7240,
          "total_reference_ms": 96000,
          "overlapping_reference_ms": 3000,
          "reference_speaker_count": 4,
          "hypothesis_cluster_count": 4,
          "scored_frames": 10204,
          "excluded_frames": 0,
          "overlap_regions_skipped": false,
          "collar_ms": 0
        },
        "single_speaker": {
          "der": 0.11722222222222223,
          "missed_ms": 1160,
          "false_alarm_ms": 2730,
          "confusion_ms": 6660,
          "total_reference_ms": 90000,
          "overlapping_reference_ms": 0,
          "reference_speaker_count": 4,
          "hypothesis_cluster_count": 4,
          "scored_frames": 9904,
          "excluded_frames": 300,
          "overlap_regions_skipped": true,
          "collar_ms": 0
        },
        "overlapping": {
          "der": 0.12333333333333334,
          "missed_ms": 160,
          "false_alarm_ms": 0,
          "confusion_ms": 580,
          "total_reference_ms": 6000,
          "overlapping_reference_ms": 3000,
          "reference_speaker_count": 4,
          "hypothesis_cluster_count": 4,
          "scored_frames": 300,
          "excluded_frames": 9904,
          "overlap_regions_skipped": false,
          "collar_ms": 0
        }
      }
    },
    {
      "session_id": "librispeech-session-01",
      "condition": "telephone_bandpass",
      "media_sha256": "cd3d87c9f6226778d875ee0fd3be153f86684f14d2797a1b81dbec7424d0b4b1",
      "duration_ms": 102000,
      "reference_speakers": 4,
      "reference_speech_ms": 96000,
      "overlapping_reference_ms": 3000,
      "hypothesis_clusters": 4,
      "hypothesis_turns": 30,
      "elapsed_ms": 14377,
      "der": {
        "overall": {
          "der": 0.1275,
          "missed_ms": 1730,
          "false_alarm_ms": 4510,
          "confusion_ms": 6000,
          "total_reference_ms": 96000,
          "overlapping_reference_ms": 3000,
          "reference_speaker_count": 4,
          "hypothesis_cluster_count": 4,
          "scored_frames": 10204,
          "excluded_frames": 0,
          "overlap_regions_skipped": false,
          "collar_ms": 0
        },
        "single_speaker": {
          "der": 0.12777777777777777,
          "missed_ms": 990,
          "false_alarm_ms": 4510,
          "confusion_ms": 6000,
          "total_reference_ms": 90000,
          "overlapping_reference_ms": 0,
          "reference_speaker_count": 4,
          "hypothesis_cluster_count": 4,
          "scored_frames": 9904,
          "excluded_frames": 300,
          "overlap_regions_skipped": true,
          "collar_ms": 0
        },
        "overlapping": {
          "der": 0.12333333333333334,
          "missed_ms": 740,
          "false_alarm_ms": 0,
          "confusion_ms": 0,
          "total_reference_ms": 6000,
          "overlapping_reference_ms": 3000,
          "reference_speaker_count": 4,
          "hypothesis_cluster_count": 4,
          "scored_frames": 300,
          "excluded_frames": 9904,
          "overlap_regions_skipped": false,
          "collar_ms": 0
        }
      }
    },
    {
      "session_id": "librispeech-session-01",
      "condition": "opus_low_bitrate",
      "media_sha256": "a9f61bcf76f92e140bec5b6382307ad9f8b3f4ac06bd21e4e84441977bd74598",
      "duration_ms": 102000,
      "reference_speakers": 4,
      "reference_speech_ms": 96000,
      "overlapping_reference_ms": 3000,
      "hypothesis_clusters": 4,
      "hypothesis_turns": 29,
      "elapsed_ms": 14272,
      "der": {
        "overall": {
          "der": 0.16364583333333332,
          "missed_ms": 2420,
          "false_alarm_ms": 3310,
          "confusion_ms": 9980,
          "total_reference_ms": 96000,
          "overlapping_reference_ms": 3000,
          "reference_speaker_count": 4,
          "hypothesis_cluster_count": 4,
          "scored_frames": 10204,
          "excluded_frames": 0,
          "overlap_regions_skipped": false,
          "collar_ms": 0
        },
        "single_speaker": {
          "der": 0.165,
          "missed_ms": 1560,
          "false_alarm_ms": 3310,
          "confusion_ms": 9980,
          "total_reference_ms": 90000,
          "overlapping_reference_ms": 0,
          "reference_speaker_count": 4,
          "hypothesis_cluster_count": 4,
          "scored_frames": 9904,
          "excluded_frames": 300,
          "overlap_regions_skipped": true,
          "collar_ms": 0
        },
        "overlapping": {
          "der": 0.14333333333333334,
          "missed_ms": 860,
          "false_alarm_ms": 0,
          "confusion_ms": 0,
          "total_reference_ms": 6000,
          "overlapping_reference_ms": 3000,
          "reference_speaker_count": 4,
          "hypothesis_cluster_count": 4,
          "scored_frames": 300,
          "excluded_frames": 9904,
          "overlap_regions_skipped": false,
          "collar_ms": 0
        }
      }
    },
    {
      "session_id": "librispeech-session-01",
      "condition": "room_impulse_response",
      "media_sha256": "61a754fb3e064e0d393001e03591b015465859f26e1eb2a3bcae81d03604bd95",
      "duration_ms": 102000,
      "reference_speakers": 4,
      "reference_speech_ms": 96000,
      "overlapping_reference_ms": 3000,
      "hypothesis_clusters": 3,
      "hypothesis_turns": 33,
      "elapsed_ms": 14276,
      "der": {
        "overall": {
          "der": 0.34989583333333335,
          "missed_ms": 2070,
          "false_alarm_ms": 3020,
          "confusion_ms": 28500,
          "total_reference_ms": 96000,
          "overlapping_reference_ms": 3000,
          "reference_speaker_count": 4,
          "hypothesis_cluster_count": 3,
          "scored_frames": 10204,
          "excluded_frames": 0,
          "overlap_regions_skipped": false,
          "collar_ms": 0
        },
        "single_speaker": {
          "der": 0.34555555555555556,
          "missed_ms": 1900,
          "false_alarm_ms": 3020,
          "confusion_ms": 26180,
          "total_reference_ms": 90000,
          "overlapping_reference_ms": 0,
          "reference_speaker_count": 4,
          "hypothesis_cluster_count": 3,
          "scored_frames": 9904,
          "excluded_frames": 300,
          "overlap_regions_skipped": true,
          "collar_ms": 0
        },
        "overlapping": {
          "der": 0.415,
          "missed_ms": 170,
          "false_alarm_ms": 0,
          "confusion_ms": 2320,
          "total_reference_ms": 6000,
          "overlapping_reference_ms": 3000,
          "reference_speaker_count": 4,
          "hypothesis_cluster_count": 3,
          "scored_frames": 300,
          "excluded_frames": 9904,
          "overlap_regions_skipped": false,
          "collar_ms": 0
        }